1. Opportunity Name,2. Region,3. County,4. Location,5. Type,6. Ensemble (if app.),7. Genre,8. Age,9. Level,10. Instruments,11. Other Tags,12. Cost,13. About Opportunity,14. When,15. Opportunity Website / Signup,16. Organisation Name,17. About Organisation,18. Organisation Website,19. Only for London/Local?,20. Extra Notes
Funk in the Forest,London,Greater London,Walthamstow School for Girls - UK,Ensemble,Jazz Group,Jazz,,Grade 3+,,"Grade 3, Grade 4, Grade 5, Grade 6, Grade 7, Grade 8",The fee for this group is separate to Music School Membership. Sign up at the link below.,"‘Funk In The Forest’ are a classic jazz-funk combo consisting of front line instruments including trumpets, trombones, saxophones and clarinets, along with a rhythm section of pianos, guitars, bass and drums. Funk in the Forest is aimed at students who have achieved Grade 3 or above on their chosen instrument and gives them an opportunity to perform in the styles of Jazz, Funk, Rock and Soul along with developing more creative skills such as improvisation and composition. The ensemble rehearses weekly on Mondays during term time and works on performing a large array of music, from swing and bebop to more modern Funk and Soul.

How do I Join?
This group is part of the Music School - please sign up for Music School Groups and Ensembles and select 'Funk in the Forest' as the group you'd like to join.",Mondays 18:30 - 19:30,https://www.wfmusichub.org/groups/explore/funk-in-the-forest,Waltham Forest Music Hub,,,Local Only,
Junior Funksters,London,Greater London,Walthamstow School for Girls - UK,Ensemble,Jazz Group,Jazz,,Beginner to Grade 2,,"Preparatory, Grade 1, Grade 2",The fee for this group is separate to Music School Membership. Sign up at the link below.,"‘Junior Funksters’ perform a mixture of upbeat funk, modern pop tunes and classic jazz standards. The group is aimed at beginners up to grade 2/3 standard. All players of brass and woodwind instruments are welcome, along with anyone who wants to jam with the rhythm section - guitarists, bass players, pianists/keyboardists and drummers! The rehearsals cover everything from learning the basic skills needed to perform in a band to beginning to learn how to improvise on your chosen instrument, so come and join the jam!

How do I Join?
This group is part of the Music School - please sign up for Music School Groups and Ensembles and select 'Junior Funksters' as the group you'd like to join.",Mondays 17:45 - 18:30,https://www.wfmusichub.org/groups/explore/junior-funksters,Waltham Forest Music Hub,,,Local Only,
Little Choir of Joy,London,Greater London,Walthamstow School for Girls - UK,Ensemble,Choir,Choral,8 - 12,Any,,,Free (with music school membership),"At the Choir of Joy children will learn lots of fun songs covering different styles including pop, folk and musical theatre. We’ll do fun warm ups, shake ourselves about and move to the beat. We’ll perform in concerts as soon as we can to share our uplifting music with others. We’re very proud that The Little Choir of Joy featured on the BBC Radio London Christmas Day Show as part of the Borough of Culture 2019.

This choir is part of the Music School - please sign up for Music School Groups and Ensembles and select 'Little Choir of Joy' as the group you'd like to join.",Saturdays 11:45 - 12:45,https://www.wfmusichub.org/groups/explore/little-choir-of-joy,Waltham Forest Music Hub,,,Local Only,
Mini Choir of Joy,London,Greater London,Walthamstow School for Girls - UK,Ensemble,Choir,Choral,5 - 7,Any,,,Free (with music school membership),"At the Mini Choir of Joy children will learn lots of fun songs covering different styles including pop, folk and musical theatre. We’ll do fun warm ups, shake ourselves about and move to the beat. We’ll perform in concerts as soon as we can to share our uplifting music with others. We’re very proud that The Mini Choir of Joy featured on the BBC Radio London Christmas Day Show as part of the Borough of Culture 2019.

How do I Join?
This group is part of the Music School - please sign up for Music School Groups and Ensembles and select 'Mini Choir of Joy' as the group you'd like to join.",Saturdays 10:30 - 11:30,https://www.wfmusichub.org/groups/explore/mini-choir-of-joy,Waltham Forest Music Hub,,,Local Only,
Mini Musicians Next Steps,London,Greater London,Walthamstow School for Girls - UK,Workshop,,Early Years,4 - 6,Any,,Early Years,£88 per term,"Our Next Steps course for children aged 4-6 years continues to develop musical skills while helping children to become more independent in their learning. It also prepares them to carry on studying a musical instrument if they wish to do so. Taught by professional musicians and Early Years Music Specialists our progressive curriculum uses a variety of musical activities to lay a foundation for future musicality, as well as helping children feeling more secure and confident when coping with new experiences. Singing and playing instruments are at the heart of every session.",Saturdays 9:15 - 10:15,https://www.wfmusichub.org/groups/explore/mini-musicians-next-steps,Waltham Forest Music Hub,,,Local Only,
Rockit! Rock/Pop Band,London,Greater London,Walthamstow School for Girls - UK,Ensemble,Rock Band,Rock,,Grade 3+,,"Grade 3, Grade 4, Grade 5, Grade 6, Grade 7, Grade 8",The fee for this group is separate to Music School Membership. Sign up at the link below.,"ROCKIT! is for young musicians who play keys, bass, guitar, kit or who sing to play together in a band and work towards live performances. In the band, musicians will learn contemporary and classic rock and pop songs.

How do I Join?
This group is part of the Music School - please sign up for Music School Groups and Ensembles and select 'Rockit! Rock/pop band' as the group you'd like to join.",Mondays 18:00 - 19:30,https://www.wfmusichub.org/groups/explore/rockit-rock-pop-band,Waltham Forest Music Hub,,,Local Only,
Roll With It Guitar Group,London,Greater London,Walthamstow School for Girls - UK,Ensemble,Guitar Group,Rock,,Musicians who can read some tab and play basic chords (Grade 1+),,"Grade 1, Grade 2, Grade 3, Grade 4, Grade 5, Grade 6, Grade 7, Grade 8",The fee for this group is separate to Music School Membership. Sign up at the link below.,"Roll With It Guitar Group is an exciting way to meet like-minded musicians with a passion for rock and pop music. Open to guitarists who play any type of guitar who can read some tab and play basic chords. This is a great opportunity to use skills in a real band situation. You will have the opportunity to pick your own songs and repertoire as well as the potential to write original material. Each term the group will perform in a concert to show off their fab new tunes.

How do I Join?
This group is part of the Music School - please sign up for Music School Groups and Ensembles and select 'Improvers Guitar Group' as the group you'd like to join.",Mondays 17:00 - 17:45,https://www.wfmusichub.org/groups/explore/rollwithit-guitar-group,Waltham Forest Music Hub,,,Local Only,
Songwriter's Circle,London,Greater London,Walthamstow School for Girls - UK,Workshop,,Songwriting,11 - 16,Any Level,,No Experience,The fee for this group is separate to Music School Membership. Sign up at the link below.,"This is open to any young person who is secondary aged and is interested in writing their own songs.

From structure and tonality to genre and instrumentation, this course covers a whole range of skills that will be useful to any young person interested in creating their own music, particularly for GCSE composition.

All students need to bring along is themselves, any material they’ve written or started to write (don’t worry if they haven’t got any!) and an instrument (if portable).

How do I Join?
This group is part of the Music School - please sign up for Music School Groups and Ensembles and select 'Songwriter's Circle' as the group you'd like to join.",Mondays 16:00 - 17:00,https://www.wfmusichub.org/groups/explore/songwriters-circle,Waltham Forest Music Hub,,,Local Only,
Strings Group,London,Greater London,Walthamstow School for Girls - UK,Ensemble,String Ensemble,Orchestral,,Beginners to Grade 3,,"Grade 1, Grade 2, Preparatory, Grade 3",Free (with music school membership),"The Strings Group is an ensemble for violin, viola, cello and double bass players. The rehearsals are varied and involve a mixture of working from sheet music, using improvisation and various musical tools to enhance the experience of learning. The group is open to beginners who can confidently use three fingers to players at Grade 3 standard.

How do I Join?
This group is part of the Music School - please sign up for Music School Groups and Ensembles and select 'Strings Group' as the group you'd like to join.",Wednesdays 17:30 - 18:30,https://www.wfmusichub.org/groups/explore/strings-group,Waltham Forest Music Hub,,,Local Only,
Wind Band,London,Greater London,Walthamstow School for Girls - UK,Ensemble,Wind Band,Orchestral,,Wind and Brass Grade 1 - 4,,"Grade 1, Grade 2, Grade 3, Grade 4",The fee for this group is separate to Music School Membership. Sign up at the link below.,"Music from movies and music from maestros, Wind Band members get to play a wide range of music in Wind Band. We play upbeat pieces and lyrical pieces, always rotating the different parts from one piece to another, so that everyone has a chance on the melody line!

How do I Join?
This group is part of the Music School - please sign up for Music School Groups and Ensembles and select 'Wind Band' as the group you'd like to join.",Wednesdays 16:30 - 17:15,https://www.wfmusichub.org/groups/explore/wind-band,Waltham Forest Music Hub,,,Local Only,
Youth Chamber Orchestra,London,Greater London,Walthamstow School for Girls - UK,Ensemble,Orchestra,Orchestral,,Grade 4+,,"Grade 4, Grade 5, Grade 6, Grade 7, Grade 8",The fee for this group is separate to Music School Membership. Sign up at the link below.,"The Youth Chamber Orchestra is one of our most advanced groups, aimed at string, woodwind, brass and percussion players Grade 4 and above. It covers core classical repertoire from Beethoven to Mozart and performs at various venues around the borough. It is a great opportunity for young musicians to develop their ensemble skills to a high level and share their love of music with like-minded instrumentalists.

How do I Join?
This group is part of the Music School - please sign up for Music School Groups and Ensembles and select 'Youth Chamber Orchestra' as the group you'd like to join.",Wednesdays 18:30 - 20:00,https://www.wfmusichub.org/groups/explore/youth-chamber-orchestra,Waltham Forest Music Hub,,,Local Only,
Chamber Music Ensembles,London,Greater London,"Burntwood School, Wandsworth - UK",Ensemble,Orchestra,Orchestral,Various,Advanced Instrumentalists,,"Grade 5, Grade 6, Grade 7, Grade 8",,"We run numerous chamber music ensembles for advanced instrumentalists, including string quartets, brass quintets, a saxophone quartet and wind ensembles. Groups are predominantly student led with support with coaching from Wandsworth Music tutors as required. All groups have regular performance opportunities throughout the year.",Various,https://wandsworthmusic.co.uk/music-academy/ensembles/,Wandsworth Music ,,,London & Local Only,
Wandsworth Music: Concert Band,London,Greater London,"Burntwood School, Wandsworth - UK",Ensemble,Concert Band,Orchestral,,Pre-Grade 1 - 4,,"Preparatory, Grade 1, Grade 2, Grade 3, Grade 4",,"Concert Band is open to young musicians playing brass, wind and percussion instruments at from Pre-Grade 1 to Grade 4 standard.

Concert Band rehearse on Wednesdays 5.30pm-6.30pm.",Wednesdays 17:30 - 18:30,https://wandsworthmusic.co.uk/music-academy/ensembles/,Wandsworth Music ,,,London & Local Only,
Guitar Ensemble,London,Greater London,"burntwood School, Wandsworth - UK",Ensemble,Guitar Group,,,Grade 1 - 4,,"Grade 1, Grade 2, Grade 3, Grade 4",,"Guitar Ensemble is open to both electric and acoustic guitarists working at approximately Grade 1 to Grade 4.

Guitar Ensemble rehearse on Wednesdays, 5pm-6pm.",Wednesdays 17:00 - 18:00,https://wandsworthmusic.co.uk/music-academy/ensembles/,Wandsworth Music ,,,London & Local Only,
Music Production & Songwriting,London,Greater London,"Burntwood School, Wandsworth - UK",Workshop,,Production/Mixing,,Any,,No Experience,,"No previous experience required!

Learn how to use loops to create your own composition; create drum beats and hooks; record your own voice or instrument and add effects; mix your track and much more!

Sessions run on Wednesdays, 6.30pm-8.30pm.

APPLY NOW",Wednesdays 18:30 - 20:30,https://wandsworthmusic.co.uk/music-academy/ensembles/,Wandsworth Music ,,https://wandsworthmusic.co.uk/music-academy/wmafees/,London & Local Only,
Percussion Ensemble,London,Greater London,"Burntwood School, Wandsworth - UK",Ensemble,Percussion Ensemble,Orchestral,,Pre-Grade 1 - 3,,"Preparatory, Grade 1, Grade 2, Grade 3",,"Percussion Ensemble is open to drummers, pianists, percussionists and other young musicians at approximately Pre-Grade 1 to Grade 3 level, who are interested in playing tuned and un-tuned orchestral percussion instruments.

Young musicians will learn the important skills and techniques required to play as part of a large ensemble, and have the opportunity to progress into other orchestras and bands.

Percussion Ensemble rehearse on Saturdays, 12.30pm-1.25pm.",Saturdays 12:30 - 13:25,https://wandsworthmusic.co.uk/music-academy/ensembles/,Wandsworth Music ,,,London & Local Only,
Pop & Rock Bands,London,Greater London,"Burntwood School, Wandsworth - UK",Ensemble,Rock Band,Rock,Years 7 - 13,Grade 5+,,"Grade 5, Grade 6, Grade 7, Grade 8",,"For senior pupils in Years 7-13 playing Electric Guitar, Bass Guitar, Drums, Keyboards and vocalists at approximately Grade 5 + standard, or equivalent.

The bands perform twice a year at the infamous Bedford in Balham once home to the likes of Ed Sheeran and Sam Smith!

There are several bands who rehearse on Saturday mornings at various times between 8.30am-1.30pm.",Saturdays 8:00 - 14:00,https://wandsworthmusic.co.uk/music-academy/ensembles/,Wandsworth Music ,,,London & Local Only,
Pop & Rock Bands (Intermediate),London,Greater London,"burntwood School, Wandsworth - UK",Ensemble,Rock Band,Rock,Various,Grade 3 - 5,,"Grade 3, Grade 4, Grade 5",,"For intermediate instrumentalists and vocalists (equivalent to approx. Grade 3-5). The bands are open to Electric Guitar, Bass Guitar, Drums, Keyboards and vocalists.

The bands perform twice a year at the infamous Bedford in Balham once home to the likes of Ed Sheeran and Sam Smith!

The bands rehearse on Saturday mornings at various times.

",Saturdays 8:00 - 14:00,https://wandsworthmusic.co.uk/music-academy/ensembles/,Wandsworth Music ,,,London & Local Only,
Pop & Rock Bands (Junior),London,Greater London,"Burntwood School, Wandsworth - UK",Ensemble,Rock Band,Rock,Years 3 - 6,Any,,No Experience,,"For young vocalists and instrumentalists in Years 3-6 playing Guitar, Bass, Drums, Keyboards and vocalists.

The bands work towards an end of year performance at the infamous Bedford Pub in Balham, once home to the likes of Ed Sheeran and Sam Smith!

The bands rehearse on Saturday mornings at various times between 11.30am & 1.30pm.","Saturdays, various times between 11:30 - 13:30",https://wandsworthmusic.co.uk/music-academy/ensembles/,Wandsworth Music ,,,London & Local Only,
Saturday Junior Academy (Wandsworth Music Academy),London,Greater London,"Burntwood School, Wandsworth - UK",Classes,,Various,Years 3 - 6,Any,,,£84 - £461 (depending on classes),"Children in years 3-6 enjoy a full morning of music making including a small group or 1-1 instrumental lesson, ensemble (orchestra or band), theory, choir, steel pans and/or djembe drumming.",Saturdays 8:00 - 14:00,https://wandsworthmusic.co.uk/music-academy/,Wandsworth Music ,,,London & Local Only,
Soundstart (Wandsworth Music Academy),London,Greater London,"Burntwood School, Wandsworth - UK",Classes,,Early Years,Year 1 & 2,Any,,Early Years,£82 - £166 per term,"SoundStart sessions run for 30 minutes and include singing, rhythm games and recorders, helping to develop children's core musical skills and foster a lifelong enjoyment of music. Y2 pupils also attend the WMA choir.",Saturdays 8:00 - 14:00,https://wandsworthmusic.co.uk/music-academy/,Wandsworth Music ,,,London & Local Only,
Steel Pan Jam,London,Greater London,"Burntwood School, Wandsworth - UK",Ensemble,Percussion Ensemble,Orchestral,Secondary Age,Any,,No Experience,,"Steel Pan Jam is open to all secondary aged pupils – No previous experience of playing steel pans is required!

Steel Pan Jam rehearse on Saturdays, 12.30pm-1.20pm.",Saturdays 12:30 - 13:30,https://wandsworthmusic.co.uk/music-academy/ensembles/,Wandsworth Music ,,,London & Local Only,
String Thing!,London,Greater London,"Burntwood School, Wandsworth - UK",Ensemble,String Ensemble,Orchestral,,Grade 1 - 4,,"Grade 1, Grade 2, Grade 3, Grade 4",,"String Thing! is open to string players working at Grade 1 to Grade 4 standard.

String Thing! rehearse on Wednesdays 5.30pm-6.30pm.

",Wednesdays 17:30 - 18:30,https://wandsworthmusic.co.uk/music-academy/ensembles/,Wandsworth Music ,,,London & Local Only,
Training Orchestra,London,Greater London,"burntwood School, Wandsworth - UK",Ensemble,Orchestra,Orchestral,Years 3 - 6,Pre Grade 1 - Grade 1,,"Preparatory, Grade 1",,"For young instrumentalists in Years 3-6 just starting out on their musical journey!

Open to wind, string and brass players who have just started learning their instruments up to approximately Grade 1.

Training orchestra rehearses on Saturday mornings at 12.30pm-1.30pm.",Saturdays 12:30 - 13:30,https://wandsworthmusic.co.uk/music-academy/ensembles/,Wandsworth Music ,,,London & Local Only,
Wandsworth Chamber Choir,London,Greater London,"Burntwood School, Wandsworth - UK",Ensemble,Choir,Choral,Years 7 - 13,Previous experience of choral singing,,,,"The Chamber Choir is for singers in Years 7-13, with previous experience of choral singing.

The Chamber choir has a particular focus on multiple part singing across a range of classical and contemporary genres.

Chamber Choir rehearse on Wednesdays, 5.30-6.15pm",Wednesdays 17:30 - 18:15,https://wandsworthmusic.co.uk/music-academy/ensembles/,Wandsworth Music ,,,London & Local Only,
Wandsworth Concert Orchestra (WCO),London,Greater London,"Burntwood School, Wandsworth - UK",Ensemble,Orchestra,Orchestral,,Grade 3 - 6,,"Grade 3, Grade 4, Grade 5, Grade 6",,"WCO is a full symphony orchestra for intermediate orchestral musicians and the feeder ensemble to the Wandsworth Philharmonic Orchestra.

The Orchestra performs a varied and challenging range of repertoire. Performance opportunities include concerts at Fairfield Halls, Croydon and the Clore Ballroom at the Southbank Centre.

WCO is open to young musicians playing brass, wind, string and percussion instruments at approximately Grade 3 to Grade 6 standard.

WCO rehearse on Saturdays, 12.30pm-1.30pm. There are also 3 days of intensive sectional coaching during the Autumn and Spring Half Term holidays.",Saturdays 12:30 - 13:30,https://wandsworthmusic.co.uk/music-academy/ensembles/,Wandsworth Music ,,,London & Local Only,
Wandsworth Jazz 2,London,Greater London,"burntwood School, Wandsworth - UK",Ensemble,Jazz Band,Jazz,Various,Grade 2 - 5,,"Grade 2, Grade 3, Grade 4, Grade 5",,"Wandsworth Jazz 2 is the feeder ensemble to the Wandsworth Jazz Orchestra. Jazz 2 is open to young musicians with a keen interest in jazz, playing Trumpet, Trombone, French Horn, Saxophone, Flute, Drums, Bass, Guitar and Keys at Grade 2 to Grade 5 standard.

The Jazz ensembles regularly perform at the Tooting Tram and Social and receive coaching from some of London’s top jazz musicians.

Jazz 2 rehearse on Saturday mornings, 10am-11am & 11am-11.50am.","Saturdays 10:00 - 11:00, 11:00 - 11:50",https://wandsworthmusic.co.uk/music-academy/ensembles/,Wandsworth Music ,,,London & Local Only,
Wandsworth Jazz Orchestra,London,Greater London,"Burntwood School, Wandsworth - UK",Ensemble,Jazz Band,Jazz,,Grade 6+,,"Audition, Grade 6, Grade 7, Grade 8",,"One of Wandsworth Music’s flagship ensembles, the Wandsworth Jazz Orchestra is for advanced musicians with a keen interest in Jazz and improvisation. The Orchestra performs a varied and challenging range of repertoire and performs annually at the London Jazz Festival alongside some of London’s top up and coming jazz talent.

Entrance is by audition for Grade 6/7+ musicians playing Trumpet, Trombone, French Horn, Saxophone, Drums, Bass, Guitar and Keys.

Wandsworth Jazz Orchestra rehearse on Wednesdays, 7.15pm-9pm.",Wednesdays 19:15 - 21:00,https://wandsworthmusic.co.uk/music-academy/ensembles/,Wandsworth Music ,,,London & Local Only,
Wandsworth Junior Orchestra,London,Greater London,"Burntwood School, Wandsworth - UK",Ensemble,Orchestra,Orchestral,,Grade 1 - 3,,"Grade 1, Grade 2, Grade 3",,"WJO is open to young musicians playing brass, wind, string and percussion instruments at approximately Grade 1 to Grade 3 standard.

The repertoire is fun and engaging and introduces young musicians to the world of ensemble playing. The highlight of the year is the annual performance at the Wandsworth Carol Concert.

WJO rehearse on Saturdays, 12.30pm-1.30pm.",Saturdays 12:30 - 13:30,https://wandsworthmusic.co.uk/music-academy/ensembles/,Wandsworth Music ,,,London & Local Only,
Wandsworth Philharmonic Orchestra,London,Greater London,"Burntwood School, Wandsworth - UK",Ensemble,Orchestra,Orchestral,,"Grade 6+ (Brass, percussion, wind)",,"Grade 6, Grade 7, Grade 8, Audition",,"One of Wandsworth Music’s flagship ensembles, WPO is a full symphony orchestra for advanced orchestral musicians. The Orchestra performs a varied and challenging range of repertoire. Performance opportunities include concerts at the Royal Albert Hall, Fairfield Halls, Wimbledon Tennis Championships and an annual European tour. Recently the orchestra have visited Slovakia, Italy, Spain and Germany.

Entrance is by audition for Grade 6+ players of brass, wind, string and percussion instruments.

WPO rehearse on Saturdays, 10.45am-12.25pm. There are also 3 days of intensive sectional coaching during the Autumn and Spring Half Term holidays.",Saturdays 10:45 - 12:25,https://wandsworthmusic.co.uk/music-academy/ensembles/,Wandsworth Music ,,,London & Local Only,
Wandsworth Youth Choir,London,Greater London,"burntwood School, Wandsworth - UK",Ensemble,Choir,Choral,Year 6+,Any,,No Experience,,"Wandsworth Youth Choir (WYC) is a group of young, enthusiastic vocalists who simply love to sing.

The choir is open to singers in Year 6+ who are passionate about singing and who are interested in performing alongside likeminded people as part of a fabulous choir.

The Youth Choir have performed at the Royal Festival Hall, Royal Albert Hall and Fairfield Halls, Croydon.

WYC rehearse on Wednesdays, 6.15pm-7.15pm",Wednesdays 18:15 - 19:15,https://wandsworthmusic.co.uk/music-academy/ensembles/,Wandsworth Music ,,,London & Local Only,
WPT Juniors,London,Greater London,"burntwood School, Wandsworth - UK",Ensemble,Musical Theatre Group,Musical Theatre,Years 3 - 6,Any,,No Experience,,"Love to sing and dance? Then Wandsworth Performance Troupe Juniors is for you!

WPT Juniors is open to vocalists in Years 3-6. No previous experience necessary – just a love of singing and dancing!

WPT Juniors explore a variety of musical styles with a focus on musical theatre. WPT regularly perform at Fairfield Halls, Croydon.

WPT Juniors rehearse on Wednesdays, 5.30pm-6.30pm.",Wednesdays 17:30 - 18:30,https://wandsworthmusic.co.uk/music-academy/ensembles/,Wandsworth Music ,,,London & Local Only,
WPT Singers,London,Greater London,"Burntwood School, Wandsworth - UK",Ensemble,Musical Theatre Group,Musical Theatre,Years 7 - 13,any,,,,"Love to sing and dance? Then Wandsworth Performance Troupe is for you!

WPT Seniors is open to vocalists in school Years 7-13. WPT explore a variety of musical styles with a focus on musical theatre. WPT regularly perform at The Royal Albert Hall and Fairfield Halls, Croydon.

WPT Seniors rehearse on Wednesdays, 7pm-8.30pm.",Wednesdays 19:00 - 20:30,https://wandsworthmusic.co.uk/music-academy/ensembles/,Wandsworth Music ,,,London & Local Only,
Wandsworth Beyond!,London,Greater London,"Wandsworth, London - UK",Ensemble,SEND Inclusive Ensemble,Various,,Any,,SEND,,"BEYOND is an inclusive, creative music ensemble for young people with Special Educational Needs/ Disabilities (SEND). The young musicians use a combination of traditional instruments, percussion, voices and music technology to create new music and develop their musical skills.

BEYOND rehearses twice a term at various schools in the borough, and perform at venues including The Royal Albert Hall and Fairfield Halls.",Various,https://wandsworthmusic.co.uk/music-academy/ensembles/,Wandsworth Music ,,,London & Local Only,
Wired4Music: 1-1 Careers Advice Sessions,London,Greater London,London - UK,Mentoring,,Various,16-25 (London Based),Any,,"Free, No Experience",Free,,By Appointment,https://www.wired4music.co.uk/opportunities/wired4music-mini-dnas-2/,Wired4Music,,,London Only,
HMS Rocks,London,Greater London,"Havering, London - UK",Ensemble,Rock Band,Rock,Year 3+,Any Level,,No Experience,,"HMS Rocks is an opportunity to explore rock music with your friends at school, or at one of our Music Centres. Bands are set up within schools based on the number of pupils who sign up. You can choose your instrument, select whether you want to learn 1:1 or just play in the band and off you go! Lessons available from KS2 (Y3) and up.",,https://www.haveringmusicschool.org.uk/packages-copy-2/,Havering Music School,,,Local Only,
