1. Opportunity Name,2. Region,3. County,4. Location,5. Type,6. Ensemble (if app.),7. Genre,8. Age,9. Level,10. Instruments,11. Other Tags,12. Cost,13. About Opportunity,14. When,15. Opportunity Website / Signup,16. Organisation Name,17. About Organisation,18. Organisation Website,19. Only for London/Local?,20. Extra Notes
Dads Rock (Southmead) - 8 Week Group,South West,Bristol,"Greenway Centre, Doncaster Road, Southmead, Bristol, BS10 5PY - UK",Workshop,,Early Years,Under 2,All ABilities,,"Early Years, Free",Free,"February 28 @ 10:00 - 11:30
Free
If you are a Bristol City Council Resident, join Evolve Music’s Southmead Dads Rock group for dads or male caregivers and children under 2!

Unleash your child’s potential with music! Develop emotional control, language, math skills & creativity through play.

STARTS: Saturday 24th January 2026

ENDS: Saturday 28th March 2026

FREQUENCY: Weekly*, Saturday mornings 10am – 11.30am

VENUE: Greenway Centre, Doncaster Road, Southmead, Bristol, BS10 5PY

Discover how child-led musical play helps with developing baby and toddler’s managing big emotions, powerful communication skills, a love of language, a foundation in numbers and their inner rockstar.

Dads Rock (it’s not just a saying, it’s a movement!) is also a chance to build a community with other Dads and share your parenting adventure and musical experiences.

The group is an 8-week adventure and is absolutely free to join. It is made possible through Bristol Family Hubs and you will need to be a Bristol City Council resident to access sessions.

Southmead Dads Rock starts on 24th January and runs until the 28th March (there are no sessions taking place on 14th February or 14th March). Ideally Dads/male caregivers will join the musical revolution for the January start but this is not mandatory, so please do get in contact with us if you can only start after this date.

DATES: Session dates are Saturday mornings 10am – 11.30am

24th January
31st January
7th February
21st February
28th February
7th March
21st March
28th March
*Please note there are no sessions running on 14th February or 14th March.

BOOKING INFO: https://www.eventbrite.co.uk/e/southmead-dads-rock-8-week-group-january-2026-tickets-1978286666674?aff=oddtdtcreator

Contact Emma if you would like further information about the group before signing up – emma@evolvemusic.org.uk","Saturdays 10:00 - 11:30 (8 - week length) 
(until 21st march)",https://evolvemusic.org.uk/whats-on/month/,Evolve Music,,,Local Only,
Bracknell Saxophone Ensemble,South East,Berkshire,Bracknell Music Centre - UK,Ensemble,Woodwind Ensemble,Orchestral,Chamber Groups,,Saxophone,,£91 per term (£82 for students),,Thursdays 18:00 - 18:45,https://www.berksmusictrust.org.uk/music/music-groups/ensembles/,Berkshire Music Trust,,https://www.berksmusictrust.org.uk,No Restriction,https://www.berksmusictrust.org.uk/wp-content/uploads/2025/07/Fees-2025-26-FINAL-EXT.pdf
Recorder Rookies - Maidenhead,South East,Berkshire,"Space to Thrive, Maidenhead - UK",Ensemble,Woodwind Ensemble,Orchestral,Year 1 - Year 2,Beginner,Recorder,"Free, No Experience",Free,This will be free for Year 1/Year 2 Mini Maestros students and is aimed at students who have never played a recorder before.,Saturdays 11:00 - 11:30,https://www.berksmusictrust.org.uk/music/music-groups/ensembles/,Berkshire Music Trust,,https://www.berksmusictrust.org.uk,No Restriction,
Windsor Out of the Attic Wind Band,South East,Berkshire,Windsor Music Centre - UK,Ensemble,Wind Band,Orchestral,18 +,Grade 5+,"Piccolo/Flute, Clarinet, Oboe, Cor Anglais, Bassoon, Trumpet, Trombone, Tuba, Horns, Percussion, Euphonium","Grade 5, Grade 6 , Grade 7, Grade 8",https://www.berksmusictrust.org.uk/wp-content/uploads/2025/07/Fees-2025-26-FINAL-EXT.pdf,"Out of the Attic is a friendly, inclusive orchestra for adults. Our name was given by our founding members, many of whom were returning to playing music after a long break and were getting their instruments back 'Out of the Attic'. This ensemble is suited to any wind, brass or percussion players in of roughly grade 5 standard or above. We are always pleased to welcome new members so please do get in touch if you would like to join.",Wednesdays 18:30 - 19:30,https://www.berksmusictrust.org.uk/music/music-groups/ensembles/,Berkshire Music Trust,,https://www.berksmusictrust.org.uk,No Restriction,
RMC @ River Academy - Initial Wind Band,South East,Berkshire,"River Academy, 7 Richfield Avenue, Reading, RG1 8EQ - UK",Ensemble,Wind Band,Orchestral,All Ages,Grade 1-3,"Piccolo/Flute, Clarinet, Oboe, Cor Anglais, Bassoon, Trumpet, Trombone, Tuba, Horns, Percussion, Euphonium","Grade 1, Grade 2, Grade 3",https://www.berksmusictrust.org.uk/wp-content/uploads/2025/07/Fees-2025-26-FINAL-EXT.pdf,"An exciting group for students who have just started to play a Wind, Brass or Percussion instrument and learn more about music.",Tuesdays 17:30 - 18:30,https://www.berksmusictrust.org.uk/music/music-groups/ensembles/,Berkshire Music Trust,,https://www.berksmusictrust.org.uk,No Restriction,
RMC @ River Academy - Let's Play Band,South East,Berkshire,"River Academy, 7 Richfield Avenue, Reading, RG1 8EQ - UK",Ensemble,Concert Band,Orchestral,All Ages,5 notes to Grade 1,"Piccolo/Flute, Clarinet, Oboe, Cor Anglais, Bassoon, Trumpet, Trombone, Tuba, Horns, Euphonium","Preparatory, Grade 1",https://www.berksmusictrust.org.uk/wp-content/uploads/2025/07/Fees-2025-26-FINAL-EXT.pdf,"An exciting, inclusive group for all beginner brass and woodwind students to play together and learn more about music.",Tuesdays 16:30 - 17:15,https://www.berksmusictrust.org.uk/music/music-groups/ensembles/,Berkshire Music Trust,,https://www.berksmusictrust.org.uk,No Restriction,
RMC @ River Academy - Initial Guitar Ensemble,South East,Berkshire,"River Academy, 7 Richfield Avenue, Reading, RG1 8EQ - UK",Ensemble,Guitar Group,Orchestral,All Ages,Grade 1 -3 ,Guitar,"Grade 1, Grade 2, Grade 3",https://www.berksmusictrust.org.uk/wp-content/uploads/2025/07/Fees-2025-26-FINAL-EXT.pdf,A fun and friendly opportunity for guitar players to come together to make music.,Thursdays 17:50 - 18:50,https://www.berksmusictrust.org.uk/music/music-groups/ensembles/,Berkshire Music Trust,,https://www.berksmusictrust.org.uk,No Restriction,
Let's Play Orchestra - Maidenhead,South East,Berkshire,"Space to Thrive, Maidenhead - UK",Ensemble,Orchestra,Orchestral,All Ages,5 notes to Grade 1,"Piccolo/Flute, Clarinet, Oboe, Cor Anglais, Bassoon, Trumpet, Trombone, Tuba, Horns, Harp, Violin, Viola, Cello, Double Bass, Euphonium","Preparatory, Grade 1",https://www.berksmusictrust.org.uk/wp-content/uploads/2025/07/Fees-2025-26-FINAL-EXT.pdf,"An exciting, inclusive group for all beginner strings, woodwind and brass students to play together and learn more about music",Saturdays 10:15 - 11:00,https://www.berksmusictrust.org.uk/music/music-groups/ensembles/,Berkshire Music Trust,,https://www.berksmusictrust.org.uk,No Restriction,
Reading Soundstage,South East,Berkshire,"Reading Music Centre, Reading - UK",Workshop,Rock Band,Rock,All Ages,"All Abilities (Electric Guitar, Bass Guitar, Keys, Drums, Singers)","Guitar, Bass Guitar, Piano/Keys, Singing, Songwriting, Composing","Preparatory, Grade 1, Grade 2, Grade 3, Grade 4, Grade 5, Grade 6, Grade 7, Grade 8",https://www.berksmusictrust.org.uk/wp-content/uploads/2025/07/Fees-2025-26-FINAL-EXT.pdf,"Soundstage is an electric band workshop where you'll learn to play a range of classic and current tracks from your favourite bands and artists, or even showcase your own song writing. Genres covered could be rock and pop, to video game music and beyond! Suitable for electric guitarists, bass guitarists, drummers, keys players and singers of all abilities.","Saturdays 13:00 - 14:00, 14:00 - 15:00",https://www.berksmusictrust.org.uk/music/music-groups/ensembles/,Berkshire Music Trust,,https://www.berksmusictrust.org.uk,No Restriction,
Berkshire Youth Wind Orchestra,South East,Berkshire,Berkshire - UK,Ensemble,Wind Band,Orchestral,All Ages,Grade 8+,"Piccolo/Flute, Clarinet, Oboe, Cor Anglais, Bassoon, Trumpet, Trombone, Tuba, Horns, Euphonium",Grade 8,https://www.berksmusictrust.org.uk/wp-content/uploads/2025/07/Fees-2025-26-FINAL-EXT.pdf,"Our newly formed wind orchestra is Berkshire Youth Wind Orchestra. Led by Musical Director John Watts, coordinated by Jessica Wilkins, BYWO is the culmination of a student’s orchestral learning, providing members with outstanding orchestral training together with musical, cultural and social experiences that are truly exceptional. BYWO meets three times per year, creating a structure similar to that of a professional orchestra, and performs at prestigious venues including the Royal Albert Hall and Birmingham Symphony Hall. There will be a yearly international tour. Previous tours have included Poland, Italy and Spain Access to BYWO is by annual audition only.",Three Times Per Year,https://www.berksmusictrust.org.uk/music/music-groups/ensembles/,Berkshire Music Trust,,https://www.berksmusictrust.org.uk,No Restriction,
Reading - Out of the Attic Orchestra,South East,Berkshire,"Reading Music Centre, Reading - UK",Ensemble,Orchestra,Orchestral,18 +,Grade 5+,"Piccolo/Flute, Clarinet, Oboe, Cor Anglais, Bassoon, Trumpet, Trombone, Tuba, Horns, Harp, Violin, Viola, Cello, Double Bass, Euphonium","Grade 5, Grade 6, Grade 7, Grade 8",https://www.berksmusictrust.org.uk/wp-content/uploads/2025/07/Fees-2025-26-FINAL-EXT.pdf,"ut of the Attic is a friendly, inclusive orchestra for adults. Our name was given by our founding members, many of whom were returning to playing music after a long break and were getting their instruments back 'Out of the Attic'. This ensemble is suited to any string, brass, woodwind or percussion players of roughly grade 5 standard or above. We are always pleased to welcome new members so please do get in touch if you would like to join.",Thursdays 19:00 - 20:00,https://www.berksmusictrust.org.uk/music/music-groups/ensembles/,Berkshire Music Trust,,https://www.berksmusictrust.org.uk,No Restriction,
West Berkshire Initial String Orchestra,South East,Berkshire,West Berkshire Music Centre - UK,Ensemble,String Ensemble,Orchestral,Young String Players,Grade 1-3,"Violin, Viola, Cello, Double Bass","Grade 1, Grade 2, Grade 3",https://www.berksmusictrust.org.uk/wp-content/uploads/2025/07/Fees-2025-26-FINAL-EXT.pdf,This ensemble is for young string players that have achieved Grade 1 to 3 standard meet to play together and consolidate their instrumental learning while having fun making music with other children of their same standard. Rehearsal time will focus on the development of basic musical skills such as rhythm and counting as well as the correct use of basic bowing techniques.,Saturdays 9:00 - 10:00,https://www.berksmusictrust.org.uk/music/music-groups/ensembles/,Berkshire Music Trust,,https://www.berksmusictrust.org.uk,No Restriction,
Wokingham Initial Brass Band,South East,Berkshire,Wokingham Music Centre - UK,Ensemble,Brass Ensemble,Orchestral,Young Brass Students,Grade 1-3,"Trumpet, Trombone, Tuba, Horns, Euphonium","Grade 1, Grade 2, Grade 3",https://www.berksmusictrust.org.uk/wp-content/uploads/2025/07/Fees-2025-26-FINAL-EXT.pdf,An exciting group for students who have just started to play a brass instrument and learn more about music.,Tuesdays 16:50 - 17:50,https://www.berksmusictrust.org.uk/music/music-groups/ensembles/,Berkshire Music Trust,,https://www.berksmusictrust.org.uk,No Restriction,
Let's Play - Guitar (Reading),South East,Berkshire,"Reading Music Centre, Reading - UK",Ensemble,Brass Ensemble,Orchestral,All Ages,5 Notes - Grade 1,Guitar,"Preparatory, Grade 1",https://www.berksmusictrust.org.uk/wp-content/uploads/2025/07/Fees-2025-26-FINAL-EXT.pdf,"A fun, inclusive group for all beginner pianists and guitarists to play together and learn more about music.",Coming Soon,https://www.berksmusictrust.org.uk/music/music-groups/ensembles/,Berkshire Music Trust,,https://www.berksmusictrust.org.uk,No Restriction,
Reading Intermediate Brass Band,South East,Berkshire,"Reading Music Centre, Reading - UK",Ensemble,Brass Ensemble,Orchestral,All Ages,Grade 3 -5,"Trumpet, Trombone, Tuba, Horns, Euphonium","Grade 3, Grade 4, Grade 5",https://www.berksmusictrust.org.uk/wp-content/uploads/2025/07/Fees-2025-26-FINAL-EXT.pdf,A fun group for brass instrument students who are keen to develop and progress their learning on music.,Saturdays 9:00 - 10:30,https://www.berksmusictrust.org.uk/music/music-groups/ensembles/,Berkshire Music Trust,,https://www.berksmusictrust.org.uk,No Restriction,
Reading Clarinet Ensemble,South East,Berkshire,"Reading Music Centre, Reading - UK",Ensemble,Woodwind Ensemble,Orchestral,All Ages,Grade 8+,Clarinet,Grade 8,https://www.berksmusictrust.org.uk/wp-content/uploads/2025/07/Fees-2025-26-FINAL-EXT.pdf,"Join our friendly cohort of clarinettists, enjoy a wide range of clarinet music and get to meet some of the more unusual members of the clarinet family, like the bellowing bass, the agile alto and the tiny mischievous E flat piccolo clarinets, as well as the regular “Liquorice Sticks”! New members always welcome.",Fridays 18:00 - 18:45,https://www.berksmusictrust.org.uk/music/music-groups/ensembles/,Berkshire Music Trust,,https://www.berksmusictrust.org.uk,No Restriction,
West Berkshire Initial Guitar Ensemble,South East,Berkshire,West Berkshire Music Centre - UK,Ensemble,Guitar Group,Orchestral,All Ages,Grade 1 - 3,Guitar,"Grade 1, Grade 2, Grade 3",https://www.berksmusictrust.org.uk/wp-content/uploads/2025/07/Fees-2025-26-FINAL-EXT.pdf,A fun and friendly opportunity for guitar players to come together to make music.,Tuesdays 18:00 - 19:00 ,https://www.berksmusictrust.org.uk/music/music-groups/ensembles/,Berkshire Music Trust,,https://www.berksmusictrust.org.uk,No Restriction,
Bracknell Initial Guitar Ensemble,South East,Berkshire,Bracknell Music Centre - UK,Ensemble,Guitar Group,Orchestral,All Ages,Grade 1 - 3,Guitar,"Grade 1, Grade 2, Grade 3",https://www.berksmusictrust.org.uk/wp-content/uploads/2025/07/Fees-2025-26-FINAL-EXT.pdf,A fun and friendly opportunity for guitar players to come together to make music.,Fridays 17:00 - 18:00,https://www.berksmusictrust.org.uk/music/music-groups/ensembles/,Berkshire Music Trust,,https://www.berksmusictrust.org.uk,No Restriction,
Berkshire Youth String Ensemble,South East,Berkshire,Berkshire - UK,Ensemble,String Ensemble,Orchestral,All Ages,Grade 8+,"Violin, Viola, Cello, Double Bass",Grade 8,https://www.berksmusictrust.org.uk/wp-content/uploads/2025/07/Fees-2025-26-FINAL-EXT.pdf,"This ensemble offers young string musicians the opportunity to experience and achieve high standard performance in a professional-like atmosphere. Also provides our most talented pupils a more prominent platform to engage in the deep study of their instruments, while also developing orchestral/ensemble skills. Whenever required, the ensemble will function as well as a fixed group for Maestros events, such as the “Junior Music Festival”, competitions and so much more!",Mondays 20:05 - 21:55,https://www.berksmusictrust.org.uk/music/music-groups/ensembles/,Berkshire Music Trust,,https://www.berksmusictrust.org.uk,No Restriction,
Let's Play - Band (West Berkshire),South East,Berkshire,West Berkshire Music Centre - UK,Ensemble,Concert Band,Orchestral,All Ages,5 Notes - Grade 1,"Piccolo/Flute, Clarinet, Oboe, Cor Anglais, Bassoon, Trumpet, Trombone, Tuba, Horns, Euphonium","Preparatory, Grade 1",https://www.berksmusictrust.org.uk/wp-content/uploads/2025/07/Fees-2025-26-FINAL-EXT.pdf,"An exciting, inclusive group for all beginner brass and woodwind students to play together and learn more about music.",Saturdays 09:15 - 10:00,https://www.berksmusictrust.org.uk/music/music-groups/ensembles/,Berkshire Music Trust,,https://www.berksmusictrust.org.uk,No Restriction,
Reading Initial Wind Band,South East,Berkshire,"Reading Music Centre, Reading - UK",Ensemble,Wind Band,Orchestral,All Ages,Grade 1 - 3,"Piccolo/Flute, Clarinet, Oboe, Cor Anglais, Bassoon, Trumpet, Trombone, Tuba, Horns, Euphonium, Percussion","Grade 1, Grade 2, Grade 3",https://www.berksmusictrust.org.uk/wp-content/uploads/2025/07/Fees-2025-26-FINAL-EXT.pdf,"An exciting group for students who have just started to play a Wind, Brass or Percussion instrument and learn more about music.",Fridays 17:00 - 18:00,https://www.berksmusictrust.org.uk/music/music-groups/ensembles/,Berkshire Music Trust,,https://www.berksmusictrust.org.uk,No Restriction,
Bracknell Senior String Orchestra,South East,Berkshire,Bracknell Music Centre - UK,Ensemble,String Ensemble,Orchestral,All Ages,Grade 6+,"Violin, Viola, Cello, Double Bass, Percussion","Grade 6, Grade 7, Grade 8",https://www.berksmusictrust.org.uk/wp-content/uploads/2025/07/Fees-2025-26-FINAL-EXT.pdf,"During this activity pupils of Grade 6 to 8 meet weekly to work on well-established string repertoire, such as pieces for string orchestra, as well as solo concerts. This ensemble regularly takes part in “Music for Youth Festival” performing in famous venues around the country. Most of the pupils that attend this ensemble are also members of the Berkshire Youth Symphony Orchestra. This String ensemble includes a social break where all senior ensembles at Music Centre can meet.",Fridays 18:00 - 20:00,https://www.berksmusictrust.org.uk/music/music-groups/ensembles/,Berkshire Music Trust,,https://www.berksmusictrust.org.uk,No Restriction,
Wokingham Intermediate String Orchestra,South East,Berkshire,Wokingham Music Centre - UK,Ensemble,String Ensemble,Orchestral,Young Players,Grade 3-5,"Violin, Viola, Cello, Double Bass, Percussion","Grade 3, Grade 4, Grade 5",https://www.berksmusictrust.org.uk/wp-content/uploads/2025/07/Fees-2025-26-FINAL-EXT.pdf,"his is a great opportunity for those more established young string players that are currently working at Grade 3 to 5 standard. During this rehearsal pupils will have a first experience of pieces that they will probably recognise from the standard orchestral repertoire. Sight-reading skills will be practised regularly and new bowing techniques will be introduced, such as those off the string articulations.",Wednesdays 17:45  - 19:15,https://www.berksmusictrust.org.uk/music/music-groups/ensembles/,Berkshire Music Trust,,https://www.berksmusictrust.org.uk,No Restriction,
Wokingham Initial String Orchestra,South East,Berkshire,Wokingham Music Centre - UK,Ensemble,String Ensemble,Orchestral,Young Players,Grade 1 - 3,"Violin, Viola, Cello, Double Bass, Percussion","Grade 1, Grade 2, Grade 3",https://www.berksmusictrust.org.uk/wp-content/uploads/2025/07/Fees-2025-26-FINAL-EXT.pdf,This ensemble is for young string players that have achieved Grade 1 to 3 standard meet to play together and consolidate their instrumental learning while having fun making music with other children of their same standard. Rehearsal time will focus on the development of basic musical skills such as rhythm and counting as well as the correct use of basic bowing techniques.,Mondays 16:30 - 17:30,https://www.berksmusictrust.org.uk/music/music-groups/ensembles/,Berkshire Music Trust,,https://www.berksmusictrust.org.uk,No Restriction,
Wokingham Initial Wind Band,South East,Berkshire,wokingham Music Centre - UK,Ensemble,Wind Band,Orchestral,All Ages,Grade 1-3,"Piccolo/Flute, Clarinet, Oboe, Cor Anglais, Bassoon, Trumpet, Trombone, Tuba, Horns, Euphonium, Percussion","Grade 1, Grade 2, Grade 3",https://www.berksmusictrust.org.uk/wp-content/uploads/2025/07/Fees-2025-26-FINAL-EXT.pdf,"An exciting group for students who have just started to play a Wind, Brass or Percussion instrument and learn more about music.",Mondays 18:00 - 19:00,https://www.berksmusictrust.org.uk/music/music-groups/ensembles/,Berkshire Music Trust,,https://www.berksmusictrust.org.uk,No Restriction,
Let's Play - Strings (Bracknell),South East,Berkshire,bracknell Music Centre - UK,Ensemble,String Ensemble,Orchestral,All Ages,5 Notes - Grade 1,"Violin, Viola, Cello, Double Bass, Percussion","Preparatory, Grade 1",https://www.berksmusictrust.org.uk/wp-content/uploads/2025/07/Fees-2025-26-FINAL-EXT.pdf,"This ensemble is a weekly opportunity for all beginner string players to join in and have a first experience of playing in an ensemble. Repertoire is based mostly around the four open strings and the occasional use of finger one. Pupils will also learn what playing with other musicians is like, preparing for informal performances around the year and learning the basics of their instrumental playing. Do come and join us!",Fridays 16:30 - 17:15,https://www.berksmusictrust.org.uk/music/music-groups/ensembles/,Berkshire Music Trust,,https://www.berksmusictrust.org.uk,No Restriction,
Berkshire Youth Bassoon Ensemble,South East,Berkshire,Berkshire - UK,Ensemble,Woodwind Ensemble,Orchestral,12 - 18,Grade 8+,Bassoon,"Grade 8, Invitation Only, Audition",https://www.berksmusictrust.org.uk/wp-content/uploads/2025/07/Fees-2025-26-FINAL-EXT.pdf,"The Berkshire Youth Bassoon Ensemble (Acer Minor) was formed in September 2010. It got its name as Acer is the genus of maple trees, from which bassoons are made. It is a by invitation ensemble, with a minimum standard of grade 8 for entry. At the moment it is 14 strong, with an age range of 12 to 18. Acer has been lucky enough to perform in many prestigious venues and has won awards at the Music for Youth Festival in Birmingham in the past, as well as prizes at a number of local festivals.

Former members of Acer have gone on to study Music at many top conservatoires and universities both in the UK and abroad. Regardless of what former members of the Acer family go on to do in their careers, they all still play their bassoons and join the current Acer group every summer for an alumni concert in aid of Acer’s charity; The Toby Fund. The Toby Fund has raised thousands of pounds over the years, in memory of one of the founding members, with the money going to maintain instruments, purchase accessories and fund masterclasses and consultation lessons for bassoonists and contrabassoonists in Berkshire. The Toby Fund and Acer will be hosting our first national event in March 2023, inviting players and teachers from all over the UK to join us for masterclasses, talks and ensembles.",Mondays 18:00 - 19:00,https://www.berksmusictrust.org.uk/music/music-groups/ensembles/,Berkshire Music Trust,,https://www.berksmusictrust.org.uk,No Restriction,
Berkshire Youth Symphony Orchestra,South East,Berkshire,Berkshire - UK,Ensemble,Orchestra,Orchestral,12 - 18,Grade 8+,"Piccolo/Flute, Clarinet, Oboe, Cor Anglais, Bassoon, Trumpet, Trombone, Tuba, Horns, Harp, Violin, Viola, Cello, Double Bass, Percussion, Euphonium",Grade 8,https://www.berksmusictrust.org.uk/wp-content/uploads/2025/07/Fees-2025-26-FINAL-EXT.pdf,"Our flagship orchestra is Berkshire Youth Symphony Orchestra. Led by Musical Director Jonathan Burnett and coordinated by Jessica Wilkins, BYSO is the culmination of a student’s orchestral learning, providing members with outstanding orchestral training together with musical, cultural and social experiences that are truly exceptional. BYSO meets three times per year, creating a structure similar to that of a professional orchestra, and performs at prestigious venues including the Royal Albert Hall and Birmingham Symphony Hall. It has benefitted from partnerships with organisations such as the BBC Concert Orchestra, RPO and BBC Symphony Orchestra, and regularly undertakes international tours to countries such as Poland, Hungary, Italy and China. Access to BYSO is by annual audition only.",Selected Weekends,https://www.berksmusictrust.org.uk/music/music-groups/ensembles/,Berkshire Music Trust,,https://www.berksmusictrust.org.uk,No Restriction,
Wokingham Intermediate Wind Band,South East,Berkshire,Wokingham Music Centre - UK,Ensemble,Wind Band,Orchestral,All Ages,Grade 3-5,"Piccolo/Flute, Clarinet, Oboe, Cor Anglais, Bassoon, Trumpet, Trombone, Tuba, Horns, Euphonium, Percussion","Grade 3, Grade 4, Grade 5",https://www.berksmusictrust.org.uk/wp-content/uploads/2025/07/Fees-2025-26-FINAL-EXT.pdf,"A fun group for students who play a Wind, Brass or Percussion instrument and are keen to develop and progress on their learning of music",Tuesdays 18:00 - 19:30,https://www.berksmusictrust.org.uk/music/music-groups/ensembles/,Berkshire Music Trust,,https://www.berksmusictrust.org.uk,No Restriction,
Bracknell Senior Brass Band,South East,Berkshire,Bracknell Music Centre - UK,Ensemble,Brass Ensemble,Orchestral,All Ages,Grade 6+,"Trumpet, Trombone, Tuba, Horns, Euphonium","Grade 6, Grade 7, Grade 8",https://www.berksmusictrust.org.uk/wp-content/uploads/2025/07/Fees-2025-26-FINAL-EXT.pdf,A fun group for all brass instrument students at a higher level and continue to advance on your learning.,Saturdays 9:30 - 11:30,https://www.berksmusictrust.org.uk/music/music-groups/ensembles/,Berkshire Music Trust,,https://www.berksmusictrust.org.uk,No Restriction,
Bracknell Intermediate Brass Band,South East,Berkshire,Bracknell Music Centre - UK,Ensemble,Brass Ensemble,Orchestral,All Ages,Grade 3-5,"Trumpet, Trombone, Tuba, Horns, Euphonium","Grade 3, Grade 4, Grade 5",https://www.berksmusictrust.org.uk/wp-content/uploads/2025/07/Fees-2025-26-FINAL-EXT.pdf,A fun group for brass instrument students who are keen to develop and progress their learning on music.,Saturdays 10:00 - 11:30,https://www.berksmusictrust.org.uk/music/music-groups/ensembles/,Berkshire Music Trust,,https://www.berksmusictrust.org.uk,No Restriction,
