1. Opportunity Name,2. Region,3. County,4. Location,5. Type,6. Ensemble (if app.),7. Genre,8. Age,9. Level,10. Instruments,11. Other Tags,12. Cost,13. About Opportunity,14. When,15. Opportunity Website / Signup,16. Organisation Name,17. About Organisation,18. Organisation Website,19. Only for London/Local?,20. Extra Notes
SAMM - Electric Guitar,South West,Devon,"Ariel Centre, Totnes - UK",Instrument Lessons,,Rock,8 - 18,Intermediate,Guitar,,from £75 per term,"An exciting guitar course for students who have a basic abillity on the electric guitar and can play a few chords and basic single note riff phrases.
 
We will follow in the footsteps of the greats & learn to play guitar like Slash, Jimi Hendrix & Kurt Cobain while cultivating your own unique preferential style!
 
We will bridge the gap between practical & theory whilst focusing on the joy of playing collectively in a group & and rocking out to each individual's strengths.",Saturdays 11:30 - 12:20,https://sammtotnes.org/%7Esammtotnes/ensembles,Saturday Morning Music - Totnes,"SaMM is a Saturday Morning Music School based in Totnes, Devon, UK. We meet every Saturday during term time in the Ariel Centre at KEVICC,
We aim to help children experience music making and improve musicianship
whilst also learning that music is a fun and rewarding social activity
We are an inclusive organisation and offer children of all ages and musical abilities – from 6 to 18 and from complete beginner to virtuoso – the opportunity to enjoy making music with others in a wide variety of ensemble workshops.",https://sammtotnes.org/%7esammtotnes/,,
SAMM - Foundation Course,South West,Devon,"Ariel Centre, Totnes - UK",Classes,,Various,6 - 8,Beginner,,,from £75 per term,"This course is aimed at 6 - 8 year olds and aims to lay a foundation in music from which students can start learning an instrument and taking part once they are 8 years old in the main groups at SaMM.
The course includes learning recorder, Ukulele, drumming, the basics of reading music and of course lots of singing and creative music making. It covers what was the national curriculum in music education and much more. ",Saturdays 11:30 - 12:20,https://sammtotnes.org/%7Esammtotnes/ensembles,Saturday Morning Music - Totnes,"SaMM is a Saturday Morning Music School based in Totnes, Devon, UK. We meet every Saturday during term time in the Ariel Centre at KEVICC,
We aim to help children experience music making and improve musicianship
whilst also learning that music is a fun and rewarding social activity
We are an inclusive organisation and offer children of all ages and musical abilities – from 6 to 18 and from complete beginner to virtuoso – the opportunity to enjoy making music with others in a wide variety of ensemble workshops.",https://sammtotnes.org/%7esammtotnes/,,
SAMM - String Group,South West,Devon,"Ariel Centre, Totnes - UK",Ensemble,String Ensemble,Orchestral,8 - 18,Beginner - Intermediate,"Violin, Viola, Cello, Double Bass, Percussion",,from £75 per term,"String Orchestra is for orchestral string instruments which are violin, viola, cello and double bass.
We play music from a range of genres including baroque, classical, romantic, twentieth century and musicals. You need to be able to read music and have lessons on your instrument to join.
Feel free to talk to Tom Deam about this ensemble if you have any questions.",Saturdays 11:30 - 12:20,https://sammtotnes.org/%7Esammtotnes/ensembles,Saturday Morning Music - Totnes,"SaMM is a Saturday Morning Music School based in Totnes, Devon, UK. We meet every Saturday during term time in the Ariel Centre at KEVICC,
We aim to help children experience music making and improve musicianship
whilst also learning that music is a fun and rewarding social activity
We are an inclusive organisation and offer children of all ages and musical abilities – from 6 to 18 and from complete beginner to virtuoso – the opportunity to enjoy making music with others in a wide variety of ensemble workshops.",https://sammtotnes.org/%7esammtotnes/,,
SAMM - Jazz Ensemble,South West,Devon,"Ariel Centre, Totnes - UK",Ensemble,Jazz Band,Jazz,8 - 18,Intermediate - Advanced,,,from £75 per term,"This group works on arrangements of jazz compositions, learning about jazz rhythms and styles. The sessions include help with improvisation to build confidence in this very important aspect the music. Almost any instrument is welcome, as long as there is enthusiasm to play jazz.",Saturdays 11:30 - 12:20,https://sammtotnes.org/%7Esammtotnes/ensembles,Saturday Morning Music - Totnes,"SaMM is a Saturday Morning Music School based in Totnes, Devon, UK. We meet every Saturday during term time in the Ariel Centre at KEVICC,
We aim to help children experience music making and improve musicianship
whilst also learning that music is a fun and rewarding social activity
We are an inclusive organisation and offer children of all ages and musical abilities – from 6 to 18 and from complete beginner to virtuoso – the opportunity to enjoy making music with others in a wide variety of ensemble workshops.",https://sammtotnes.org/%7esammtotnes/,,
SAMM - Rock Band,South West,Devon,"Ariel Centre, Totnes - UK",Ensemble,Rock Band,Rock,8 - 18,Intermediate - Advanced,,,from £75 per term,SaMM Rock Band - details coming soon!,Saturdays 10:30 - 11:20,https://sammtotnes.org/%7Esammtotnes/ensembles,Saturday Morning Music - Totnes,"SaMM is a Saturday Morning Music School based in Totnes, Devon, UK. We meet every Saturday during term time in the Ariel Centre at KEVICC,
We aim to help children experience music making and improve musicianship
whilst also learning that music is a fun and rewarding social activity
We are an inclusive organisation and offer children of all ages and musical abilities – from 6 to 18 and from complete beginner to virtuoso – the opportunity to enjoy making music with others in a wide variety of ensemble workshops.",https://sammtotnes.org/%7esammtotnes/,,
SAMM - Junior Songwriting,South West,Devon,"Ariel Centre, Totnes - UK",Ensemble,Rock Band,Rock,9 - 11,Beginner,,,from £75 per term,This ensemble has been created specifically for those children who want to learn basic music skills through songwriting. For 9 - 11 yr olds,Saturdays 11:30 - 12:20,https://sammtotnes.org/%7Esammtotnes/ensembles,Saturday Morning Music - Totnes,"SaMM is a Saturday Morning Music School based in Totnes, Devon, UK. We meet every Saturday during term time in the Ariel Centre at KEVICC,
We aim to help children experience music making and improve musicianship
whilst also learning that music is a fun and rewarding social activity
We are an inclusive organisation and offer children of all ages and musical abilities – from 6 to 18 and from complete beginner to virtuoso – the opportunity to enjoy making music with others in a wide variety of ensemble workshops.",https://sammtotnes.org/%7esammtotnes/,,
Sidmouth Town Band Academy,South West,Devon,"St Francis Hall, Sidmouth - UK",Ensemble,Brass Ensemble,Orchestral,Young Brass Players,Beginners,,,Enquire for more info,"Launching in Autumn 2022, a group of players from the band offered their time and assistance to any efforts toward growing more brass playing in the local area, and integrate those players into the Training Band, and then Senior Band when ready. The Academy was formed, which quickly split into an Academy Band, and tuition sessions for our ‘new starters’.

We have met lots of local young people since, seeking to start a brass instrument or join their first band. We have often been able to loan a brass instrument to learn with, and music provided as well. We are lucky to have Adrian Harvey and Matt Sherwood to run the ‘new starter’ tuition sessions. The band and new starters are challenged weekly, including learning about how to conduct themselves ready for performances and how ensemble rehearsals work, while learning new pieces and improving them week on week.

We love to see the enjoyment from the players and their families in rehearsal, performing and when having a joke together, because don’t forget, playing in an ensemble is fun!

The success of our young members and the running of the Academy is with thanks to the Friends of the Band and all of STB's supporters, which we value and appreciate.

As many of the members are loaning our instruments, we also offer support with taking care of them. Josie Sherwood, running the Academy Band, enjoys holding Brass maintenance sessions to teach them how to take care of and clean their instruments.

We have a strong and growing membership in the academy band, particularly from our new starter players graduating into the Academy Band. To help with this transition, we have supported some of our players with our STB Tuition Grant. This contributes to the tuition costs so they can continue their learning while attending the Academy Band. We recognise that finding tuition locally is a challenge, and for some a financial barrier that we want to help reduce, with the goal of creating more brass musicians in the area.

We have no doubt that soon enough some of our Academy players will be graduating into the Training Band.

We like to hold an Open evening in September to tell you all about how the Academy works, but we would love to hear from any young people in the area looking to take up a brass instrument or join a band at any time. We meet at St Francis Hall from 7-7:45pm every Friday.

Why not ask us about joining or find out more about the STB Grant by emailing us at info@sidmouthtownband.co.uk",Fridays 19:00 - 19:45,https://sidmouthtownband.co.uk/stb-academy/,Sidmouth Town Band,"There has been a band in Sidmouth for over 150 years, with the earliest record being a picture of the band taken in 1862.

By the turn of the century, the Band had become part of the local Army Volunteers, and had mixed brass and woodwind instruments. By 1908, the band was changing back to all brass instruments and in 1911 the transformation was complete.

The band was forced to put their kit away in 1914, but reformed in 1919, winning prizes in 1929, 1930 and 1931 at Crystal Palace. History repeated itself in 1939, when the instruments were laid aside once again and many of the band went off to war. In 1947, the band was reformed, becoming affiliated to the SWBBA.",https://sidmouthtownband.co.uk,,Josie Sherwood at  info@sidmouthtownband.co.uk
East Devon Daytime Band,South West,Devon,Sidmouth Rugby Football Club Pavilion - UK,Ensemble,Brass Ensemble,Orchestral,All brass/perc players (available during the day),All abilities,,"Grade 1, Grade 2, Grade 3, Grade 4, Grade 5, Grade 6, Grade 7, Grade 8, Preparatory",£10 per month,"Since its inception the Band has successfully held regular Christmas Carolling and Easter performance events which has enabled us to donate to our nominated charities a total sum amounting to some £1,800+ shared between Devon Air Ambulance, Devon Freewheelers, Alzheimer’s Society Devon & Cornwall Branch, Sid Vale Talking Newspaper Association, St Petrocs, Exeter & the Ukrainian Red Cross.

We have successfully held performances for Cats Protection, Ottery St Mary; Dalwood Coffee and Christmas Concerts;  Kings Manor, Ottery St Mary; Green Tree Court, Pinhoe: Sundial Care Home, Tipton St. John; Exmouth Stroke Club; Seaton Care Home; Vale View Care Home, Sidford; Churchill Homes Lockyer Lodge, Newton Poppleford Primary School and Ikea Exeter store all from whom we have received warm and appreciative feedback.  

We warmly welcome new and lapsed brass and percussion players so if you are interested in joining us, and would like any further information about the Band or for booking enquiries please complete the ‘contact us’ form on this site.

Band rehearsals are held on Wednesdays ​from 10.15 a.m. to 12.15 pm ​in our band room at Sidmouth Rugby Football Club Pavilion, Byes Lane, Sidford, EX10 9PY. There is a player contribution of £10 per month.",Wednesdays 10:00 - 12:15,https://eastdevondaytimeband.weebly.com,East Devon Daytime Band,"Since its inception the Band has successfully held regular Christmas Carolling and Easter performance events which has enabled us to donate to our nominated charities a total sum amounting to some £1,800+ shared between Devon Air Ambulance, Devon Freewheelers, Alzheimer’s Society Devon & Cornwall Branch, Sid Vale Talking Newspaper Association, St Petrocs, Exeter & the Ukrainian Red Cross.

We have successfully held performances for Cats Protection, Ottery St Mary; Dalwood Coffee and Christmas Concerts;  Kings Manor, Ottery St Mary; Green Tree Court, Pinhoe: Sundial Care Home, Tipton St. John; Exmouth Stroke Club; Seaton Care Home; Vale View Care Home, Sidford; Churchill Homes Lockyer Lodge, Newton Poppleford Primary School and Ikea Exeter store all from whom we have received warm and appreciative feedback.  

We warmly welcome new and lapsed brass and percussion players so if you are interested in joining us, and would like any further information about the Band or for booking enquiries please complete the ‘contact us’ form on this site.

Band rehearsals are held on Wednesdays ​from 10.15 a.m. to 12.15 pm ​in our band room at Sidmouth Rugby Football Club Pavilion, Byes Lane, Sidford, EX10 9PY. There is a player contribution of £10 per month.",https://eastdevondaytimeband.weebly.com,,
Sidmouth Town Training Band,South West,Devon,"St Francis Hall, Sidmouth - UK",Ensemble,Brass Ensemble,Orchestral,Young Brass Players,All abilities,,,Enquire for more info,Enquire for more info,Enquire for more info,https://sidmouthtownband.co.uk/stb-academy/,Sidmouth Town Band,"There has been a band in Sidmouth for over 150 years, with the earliest record being a picture of the band taken in 1862.

By the turn of the century, the Band had become part of the local Army Volunteers, and had mixed brass and woodwind instruments. By 1908, the band was changing back to all brass instruments and in 1911 the transformation was complete.

The band was forced to put their kit away in 1914, but reformed in 1919, winning prizes in 1929, 1930 and 1931 at Crystal Palace. History repeated itself in 1939, when the instruments were laid aside once again and many of the band went off to war. In 1947, the band was reformed, becoming affiliated to the SWBBA.",https://sidmouthtownband.co.uk,,Josie Sherwood at  info@sidmouthtownband.co.uk
Sidmouth Town Band ,South West,Devon,"St Francis Hall, Sidmouth - UK",Ensemble,Brass Ensemble,Orchestral,Young Brass Players,All abilities,,,Enquire for more info,Enquire for more info,Enquire for more info,https://sidmouthtownband.co.uk/stb-academy/,Sidmouth Town Band,"There has been a band in Sidmouth for over 150 years, with the earliest record being a picture of the band taken in 1862.

By the turn of the century, the Band had become part of the local Army Volunteers, and had mixed brass and woodwind instruments. By 1908, the band was changing back to all brass instruments and in 1911 the transformation was complete.

The band was forced to put their kit away in 1914, but reformed in 1919, winning prizes in 1929, 1930 and 1931 at Crystal Palace. History repeated itself in 1939, when the instruments were laid aside once again and many of the band went off to war. In 1947, the band was reformed, becoming affiliated to the SWBBA.",https://sidmouthtownband.co.uk,,Josie Sherwood at  info@sidmouthtownband.co.uk
Adventurers; musical playgroup for d/Deaf or Visually Impaired preschoolers,South West,Devon,"ELM Community Centre, Plymouth - UK",Workshop,,Other,Preschool,d/Deaf or Visually Impaired preschoolers,,Free,Free,"Adventurers; musical play group for d/Deaf or Visually Impaired preschoolers is our musical session for deaf or VI children and their parents/caregivers

Our interactive sessions are designed to support children’s development in areas such as communication, language and creativity; exploring musical sensory play in a safe and fun environment alongside other families.

Working in partnership with Plymouth City Council, Deaf Choices UK and local Teachers of the Deaf, we will join together with families each week to celebrate children’s uniqueness within an enabling and supportive creative space.

This is a closed session, but if you would like any more information about our work in Devon, please contact

beth@evolvemusic.org.uk","Tuesdays 10:00 - 11:30 

(closed session, enquire about getting involved via email)",https://evolvemusic.org.uk/whats-on/month/,Evolve Music,,,,
Sound Lab (Yeovil),South West,Devon,"The GateWay, Addlewell Ln, Yeovil BA20 1QN - UK",Workshop,,Other,14+,with ASC and/or learning difficulties.,,Free,Free,"Join our Sound Lab Yeovil group and explore, collaborate, express your inner musicality and have fun through improvisation, songwriting, music technology, instrumental performance and games. These weekly sessions are designed specifically for young people aged 14+ with ASC and/or learning difficulties.

Get in contact with mark@evolvemusic.org.uk if you would like to try or join this group and we will complete an inclusion form with you to make sure you can get the most out of these sessions.",Tuesdays 17:30 - 19:00,https://evolvemusic.org.uk/whats-on/month/,Evolve Music,,,,
SEND Adventurers; musical play group for preschoolers with SEND/ SEMH needs,South West,Devon,Newton Abbott Children's Centre - UK,Workshop,,Early Years,0 - 5,SEND,,"SEND, Free",Free,"Sound Adventurers is our musical play early years programme for children and caregivers. Working with children age 0-5 and their parents/ caregivers we use music to connect, communicate and support children’s wellbeing.

Working alongside Devon Family Hubs in Newton Abbot, our SEND Adventurers group joins together each week to celebrate children’s uniqueness within an enabling and supportive creative space.

This is a closed session, but if you would like any more information about our work in Devon, please contact

beth@evolvemusic.org.uk","Thursdays 10:00 - 11:30

(closed session, enquire about getting involved via email)",https://evolvemusic.org.uk/whats-on/month/,Evolve Music,,,,
Sound Lab (Radstock),South West,Devon,Radstock Youth Club - UK,Workshop,,Early Years,All ages?,All ABilities,,Free,Free,"Join our Sound Lab Radstock group and explore, collaborate, express your inner musicality and have fun through improvisation, songwriting, music technology, instrumental performance and games.

Get in contact with mark@evolvemusic.org.uk if you would like to try or join this group and we will complete an inclusion form with you to make sure you can get the most out of these sessions.",Fridays 17:45 - 19:15,https://evolvemusic.org.uk/whats-on/month/,Evolve Music,,,,
Dads Rock (Barton Hill) - 8 Week Group,South West,Devon,"43 Ducie Rd, Barton Hill, Bristol BS5 0AX - UK",Workshop,,Early Years,Under 2,All ABilities,,"Early Years, Free",Free,"If you are a Bristol City Council Resident, join Evolve Music’s Barton Hill Dads Rock group for dads or male caregivers and children under 2!

Unleash your child’s potential with music! Develop emotional control, language, math skills & creativity through play.

STARTS: Saturday 17th January 2026

ENDS: Saturday 21st March 2026

FREQUENCY: Weekly, Saturday mornings 10am – 11.30am

VENUE: The Swannery @ Wellspring Settlement, 43 Ducie Rd, Barton Hill, Bristol BS5 0AX

Discover how child-led musical play helps with developing baby and toddler’s managing big emotions, powerful communication skills, a love of language, a foundation in numbers and their inner rockstar.

Dads Rock (it’s not just a saying, it’s a movement!) is also a chance to build a community with other Dads and share your parenting adventure and musical experiences.

The group is an 8-week adventure and is absolutely free to join. It is made possible through Bristol Family Hubs and you will need to be a Bristol City Council resident to access sessions.

Barton Hill Dads Rock starts on 17th January 2026 and runs until the 21st March (there are no sessions taking place on 14th or 21st February due to half term). Ideally Dads / male caregivers will join the musical revolution for the January start but this is not mandatory, so please do get in contact with us if you can only start after this date.

DATES: Session dates are Saturday mornings 10am – 11.30am

17th January
24th January
31st January
7th February
28th February
7th March
14th March
21st March
*Please note there are no sessions running on 14th or 21st February.

BOOKING INFO: https://www.eventbrite.co.uk/e/barton-hill-dads-rock-8-week-group-january-2026-tickets-1978355874677?aff=oddtdtcreator

Contact Emma if you would like further information about the group before signing up – emma@evolvemusic.org.uk","Saturdays 10:00 - 11:30 (8 - week length) 
(until 21st march)",https://evolvemusic.org.uk/whats-on/month/,Evolve Music,,,Local Only,Bristol City Residents
Dads Rock (Hartcliffe) - 8 Week Group,South West,Devon,"Hartcliffe Nursery and Children’s Centre, Hareclive Road, Bristol BS13 0JW - UK",Workshop,,Early Years,Under 2,All ABilities,,"Early Years, Free",Free,"February 28 @ 10:00 - 11:30
Free
If you are a Bristol City Council Resident, join Evolve Music’s Hartcliffe Dads Rock group for dads or male caregivers and children under 2!

Unleash your child’s potential with music! Develop emotional control, language, math skills & creativity through play.

STARTS: Saturday 17th January 2026

ENDS: Saturday 21st March 2026

FREQUENCY: Weekly*, Saturday mornings 10am – 11.30am

VENUE: Hartcliffe Nursery and Children’s Centre, Hareclive Road, Bristol BS13 0JW

Discover how child-led musical play helps with developing baby and toddler’s managing big emotions, powerful communication skills, a love of language, a foundation in numbers and their inner rockstar.

Dads Rock (it’s not just a saying, it’s a movement!) is also a chance to build a community with other Dads and share your parenting adventure and musical experiences.

The group is an 8-week adventure and is absolutely free to join. It is made possible through Bristol Family Hubs and you will need to be a Bristol City Council resident to access sessions.

Hartcliffe Dads Rock starts on 17th January 2026 and runs until the 21st March (there are no sessions taking place on 14th or 21st February due to half term). Ideally Dads / male caregivers will join the musical revolution for the January start but this is not mandatory, so please do get in contact with us if you can only start after this date.

DATES: Session dates are Saturday mornings 10am – 11.30am

17th January
24th January
31st January
7th February
28th February
7th March
14th March
21st March
*Please note there are no sessions running on 14th or 21st February.

BOOKING INFO: https://www.eventbrite.co.uk/e/hartcliffe-dads-rock-8-week-course-january-2026-tickets-1978355642984?aff=oddtdtcreator

Contact Emma if you would like further information about the group before signing up – emma@evolvemusic.org.uk","Saturdays 10:00 - 11:30 (8 - week length) 
(until 21st march)",https://evolvemusic.org.uk/whats-on/month/,Evolve Music,,,Local Only,Bristol City Residents
Sound Lab (Online),South West,Devon,Devon - UK,Workshop,,,14+,All ABilities,,"Free, SEND",Free,"Get creative from home with Sound Lab Online!

We invite young people (aged 14+) with ASC or additional learning needs to connect and collaborate through our free, fun, and social online music programme! Over the course of 1-hour sessions, we’ll guide you through composition skills, music production techniques, and interactive musical games. You will need access to a screen camera and a Zoom account. Boost your skills and make some noise with us at Sound Lab Online!

Get in contact with mark@evolvemusic.org.uk if you would like to try or join this group and we will complete an inclusion form with you to make sure you can get the most out of these sessions.",Fridays 17:45 - 18:15 (ONLINE) - check for exact dates,https://evolvemusic.org.uk/whats-on/month/,Evolve Music,,,,
South Dartmoor Junior Orchestra,South West,Devon,South Darmtmoor Community College - UK,Ensemble,Orchestra,Orchestral,"Students in Years 4 - 6 in primary and Years 7 - 8 in secondary who are actively learning an
instrument from beginner level up to Grade 3 standard.",Beginner - Grade 3,,"Preparatory, Grade 1, Grade 2, Grade 3, Free",Free,"With funding from Devon & Torbay Music Education Hubs, we are delighted to be able to
offer students the opportunity to play with an orchestra, alongside other young musicians
from the South Dartmoor Learning Community. The orchestra is led by our Visiting Music
Teachers and there will be opportunities for our orchestra to perform at events in 2025-2026.
Who can attend?
Students in Years 4 - 6 in primary and Years 7 - 8 in secondary who are actively learning an
instrument from beginner level up to Grade 3 standard.
How much does it cost?
Thanks to funding from Devon & Torbay Music Education Hubs, we offer this opportunity to
students for free.
When and where does it run?
Thursdays, weekly from 4.00 – 5.00pm in the South Dartmoor College Music Department. The
first session is on Thursday, 2nd October 2025.
How do I sign-up?
We will need a registration and consent form [i","Thursdays, weekly from 4.00 – 5.00pm in the South Dartmoor College Music Department. The
first session is on Thursday, 2nd October 2025.",https://www.southdartmoor.devon.sch.uk/attachments/download.asp?file=7530&type=pdf,South Dartmoor Primary Music Centre,,,No Restriction,"Our Music Centre is for primary school pupils in Years 4, 5 and 6. We cater for pupils who live
in the South Dartmoor Community College catchment area, or those who attend a partner
(feeder) primary school. Pupils from outside this area are welcome to attend if places are
available."
